,season,episode,rating,title,description,airdate
114,6,25,7.8,The Chump,"Michael continues to see Donna even after learning she's married and meeting her husband, Dwight and Angela take their baby contract to an arbitrator, and Jim and Pam struggle to stay awake at the office.",2010-05-13
115,6,26,8.0,Whistleblower,"Jo comes to the Scranton branch to find the whistle-blower. However, three different people have confessed to Michael, Michael is protecting them, and the person most people think is the culprit is keeping his mouth shut.",2010-05-20
116,7,1,8.4,Nepotism,"Everybody demands that Michael fire the new office assistant, but he won't because he's his nephew. Meanwhile, Pam tries to play a prank on Dwight, who has bought the office building, to make up for ruining Jim's prank.",2010-09-23
117,7,2,8.2,Counseling,"Michael is forced to go through counseling with Toby, Dwight seeks revenge on a local mall that refused his business, and Pam tries to fake her way to a promotion.",2010-09-30
118,7,3,8.2,Andy's Play,"Andy invites the entire office to watch him in the community theater production of ""Sweeney Todd,"" but Erin decides to babysit for Jim and Pam instead, and Michael is upset because he auditioned for the lead and didn't get it.",2010-10-07
119,7,4,7.9,Sex Ed,"A herpes scare causes Michael to get back in touch with his ex-girlfriends, where he decides to reevaluate those relationships. Meanwhile, Andy tries to teach safe sex to his officemates, but he has a clear ulterior motive.",2010-10-14
120,7,5,7.8,The Sting,"Michael organizes a sting operation to find out the secrets of a rival paper company's salesman who is stealing Dunder Mifflin's clients, and Andy gets Darryl's help to form a band.",2010-10-21
121,7,6,8.2,Costume Contest,"It's Halloween at Dunder Mifflin, and Michael is upset that Darryl went over his head with an idea, and Jim and Pam are obsessed with finding out why Danny didn't call Pam back when they were dating four years ago.",2010-10-28
122,7,7,7.4,Christening,"During Jim and Pam's daughter's christening, Michael becomes upset over the lack of family-like unity between himself and his employees. So he responds by impulsively joining a teenage church mission to Mexico.",2010-11-04
123,7,8,7.8,Viewing Party,"Michael sabotages Erin's ""Glee"" viewing party because of his contempt for Gabe, Jim and Pam discover that Dwight can keep their daughter from crying, and Andy has a bad reaction to a mixture of wine and a Japanese stimulant.",2010-11-11
124,7,9,7.7,WUPHF.com,"Some co-workers who invested in Ryan's Internet venture want him to sell, but Michael refuses to go along. Meanwhile, Jim loses his motivation to work when he reaches his commission cap, and Dwight creates a hay festival in the parking lot.",2010-11-18
125,7,10,8.2,China,"Pam stands up to Dwight when he makes cutbacks to save money in the building, but will Dwight have the last laugh? Meanwhile, the office is surprised and energized when Michael outsmarts Oscar in a debate about China.",2010-12-02
126,7,11,9.0,Classy Christmas,"Michael throws an elaborate Christmas party to celebrate Holly's temporary return to the Scranton branch, but is disappointed when he learns that she still has a boyfriend.",2010-12-09
127,7,13,8.3,Ultimatum,"Michael gets upset when Holly returns from the holidays without an engagement ring, but still together with her boyfriend. Meanwhile, Pam tries to help her co-workers keep with their New Year's resolutions.",2011-01-20
128,7,14,7.7,The Seminar,"Andy tries to host a small business seminar at the office. Michael agrees to help by posing as a Greek entrepreneur, and tries to get Holly to play along.",2011-01-27
129,7,15,8.5,The Search,"When Jim gets an emergency phone call from Helene, he is forced to leave Michael in the bathroom of a gas station. Meanwhile, Holly, Erin and Dwight set out on a journey to find Michael. Back at the office Pam's artwork starts a captioning contest that seems to offend Gabe.",2011-02-03
130,7,16,8.4,PDA,"It's Valentine's Day, and the office is fed up with Michael and Holly's PDA, Andy helps Erin solve Gabe's riddles to find her gift, and Jim and Pam get drunk and try to find a place in the office to have sex.",2011-02-10
131,7,17,9.4,Threat Level Midnight,"Michael finally finishes his movie ""Threat Level Midnight"" and screens it for his employees at Dunder Mifflin, but Holly is less than enthusiastic for his finished product.",2011-02-17
132,7,18,7.5,Todd Packer,"Everyone is up in arms after Michael convinces Holly to give Todd Packer an office job, and Andy gets upset after Pam gets a new computer for reception but not for him.",2011-02-24
133,7,19,9.3,Garage Sale,"Michael plans to propose to Holly the day of the Dunder Mifflin garage sale, but Holly may have to take an extended leave of absence to Colorado because her father is sick.",2011-03-24
134,7,20,7.8,Training Day,"Michael makes fast friends with the man coming in to replace him at Dunder Mifflin, but later begins to have second thoughts after seeing him in action.",2011-04-14
135,7,21,9.0,Michael's Last Dundies,"Michael hosts his final ""Dundies"" as the boss at the Scranton branch, but tension is in the air, and Deangelo Vickers, the new boss, is having trouble with his co-hosting duties.",2011-04-21
136,7,22,9.8,"Goodbye, Michael","As the office gets ready for Michael's final day at Dunder Mifflin, Michael doesn't tell anyone that he's leaving a day early. Meanwhile, Deangelo accompanies a nervous Andy on a visit to one of Michael's old clients.",2011-04-28
137,7,23,7.7,The Inner Circle,"Tensions rise and feelings are hurt when Deangelo creates an ""inner circle"" at the office--which is only composed of men.",2011-05-05
138,7,24,8.7,"Dwight K. Schrute, (Acting) Manager","When Jim rejects Jo's offer, Dwight becomes acting manager at the Scranton branch, but an accident could cause his tenure to be short-lived.",2011-05-12
139,7,25,8.8,Search Committee,"The Scranton branch puts together a search committee to find the next boss, but the pool of interviewees proves to be less than impressive, and Dwight demands an interview in spite of his gun accident.",2011-05-19
140,8,1,8.2,The List,"New Dunder Mifflin CEO Robert California leaves a piece of paper with a line down the middle that has names of the Scranton staff on either side of it, leading everyone to try and figure out what it means.",2011-09-22
141,8,2,8.1,The Incentive,"Under pressure from Robert to increase branch sales, Andy offers an incentive program to the sales staff, which backfires on him when he offers a very personal grand prize.",2011-09-29
142,8,3,7.3,Lotto,"After the entire warehouse staff wins the lottery and quits their job, Darryl becomes depressed and demands to be fired. Meanwhile, the office staff is forced to load the truck for their orders themselves.",2011-10-06
143,8,4,8.1,Garden Party,"Andy claims to be throwing a garden party at Dwight's farm to impress Robert California, but he's really doing it to win the approval of his parents, who appear to favor his younger brother.",2011-10-13
144,8,5,7.6,Spooked,"Erin is worried that she is about to get fired after she organizes a disastrous office Halloween party for Robert and his son. Meanwhile, Robert probes the minds of the employees to come up with the perfect spooky story.",2011-10-27
145,8,6,7.7,Doomsday,"Dwight installs a ""Doomsday Device"" on the office computers that could get everyone fired if they make too many mistakes, while Gabe tries to hit on one of Darryl's warehouse employees.",2011-11-03
146,8,7,7.7,Pam's Replacement,"A pregnant and insecure Pam tries to prove that Jim is attracted to her temp replacement, and Robert and his musician friends take over a jam session with Andy, Kevin and Darryl.",2011-11-10
147,8,8,6.9,Gettysburg,Andy decides to motivate and inspire everyone by taking them on a field trip to Gettysburg. Some people in the office stay behind and Robert California asks them to come up with Dunder Mifflin/Sabre's next big idea.,2011-11-17
148,8,9,7.7,Mrs. California,"Robert brings his wife to the office so that she can find a job, but he gives Andy conflicting messages about whether to hire her. Meanwhile, Dwight opens a gym in the building and tries to persuade Darryl to join.",2011-12-01
149,8,10,8.0,Christmas Wishes,"Andy tries to make this year's Christmas the best ever by granting each person's holiday wishes. Meanwhile, Robert California tries to drown his sorrows at the office party.",2011-12-08
150,8,11,7.9,Trivia,"Andy hopes to make up for a sales deficiency by entering and winning a bar trivia competition, while Dwight flies to corporate headquarters in Florida to demand a management interview with Robert.",2012-01-12
151,8,12,8.0,Pool Party,"Robert throws a party for the Dunder Mifflin staff at his house before he sells it because of his divorce. At the party, Erin and Dwight agree to flirt with each other to make Andy jealous, and Jim tries in vain to duck out early.",2012-01-19
152,8,13,7.5,Jury Duty,"Jim gets caught in a lie about his week of ""jury duty,"" and new questions emerge when Angela gives birth to a ""premature"" baby.",2012-02-02
153,8,14,7.7,Special Project,"Andy puts Dwight in charge of a special project in Tallahassee, but Dwight doesn't like the team Andy's assembled for him. Meanwhile, Darryl tries to figure out the meaning of Val's Valentine's gift.",2012-02-09
154,8,15,7.8,Tallahassee,"Dwight refuses to let appendicitis get in the way of leading his new team in Tallahassee, while Andy decides to step in for Erin as secretary in the office.",2012-02-16
155,8,16,8.1,After Hours,"In Tallahassee, Dwight and Todd Packer try to romance Nellie to get the VP position, while Jim wonders if a colleague is trying to hit on him. Back in Scranton, Val's boyfriend shows up with a message for Darryl.",2012-02-23
156,8,17,7.8,Test the Store,"Dwight and his team get ready for the grand opening of the Sabre Store, while Andy makes Toby teach self-defense to the Scranton branch employees after he is beat up in the parking lot by a girl.",2012-03-01
157,8,18,7.8,Last Day in Florida,"Jim tries to warn Dwight that he's going to be fired after Robert rejects the Sabre Store idea, but he refuses to listen. Meanwhile, Darryl and Toby try to sell cookies to Kevin, and Erin tells Andy she's not coming back from Florida.",2012-03-08
158,8,19,6.6,Get the Girl,"Andy goes to Tallahassee to tell Erin that he loves her and needs her to return to Scranton. Meanwhile, Nellie shows up in Scranton and tries to claim Andy's manager position by offering everyone raises.",2012-03-15
159,8,20,7.1,Welcome Party,"Andy tries to break up with his girlfriend after going to Florida to declare his love for Erin, and the office employees are forced against their will to throw a party for the hated Nellie.",2012-04-12
160,8,21,7.1,Angry Andy,"Andy and Erin return to Dunder Mifflin, only to discover that Nellie has taken his job and office and refuses to give them up. Meanwhile, Ryan becomes jealous after Pam tries to play matchmaker for Kelly.",2012-04-19
161,8,22,7.1,Fundraiser,Andy confronts Robert for the first time after losing the manager position and quitting his job at a fund raiser sponsored by Angela's husband.,2012-04-26
162,8,23,7.6,Turf War,"Dwight and Jim fight with the Syracuse over a client after Robert shuts down the Binghamton branch, and Andy sees an opportunity for revenge. Meanwhile Robert tries to figure out the contents of a drunken voicemail to Nellie.",2012-05-03
163,8,24,7.7,Free Family Portrait Studio,"With former CEO David Wallace's help, Andy launches a plan to get revenge on the Scranton branch. Meanwhile, Dwight launches his own plan to find out if he's the father of Angela's baby.",2012-05-10
164,9,1,7.6,New Guys,"Dwight and Jim are intimidated by the office's newest additions, who are considered younger versions of themselves. Meanwhile, Andy tries to make Nellie's life miserable, and Angela tries to get rid of one of her cats.",2012-09-20
165,9,2,7.2,Roy's Wedding,"After Roy's wedding, Jim and Pam wonder if they still have any secrets they're hiding from each other. Meanwhile, Clark tricks Erin into a ""news audition,"" and Dwight challenges Nellie's new charity initiative.",2012-09-27
166,9,3,7.4,Andy's Ancestry,"Nellie plays a trick on Andy after researching his ancestry, Dwight teaches Erin a new language, and Pam tries to teach Nellie how to drive.",2012-10-04
167,9,4,7.8,Work Bus,"When Jim convinces Dwight that the building is unsafe, Dwight rents a bus and sets up the office inside. Nellie asks for Andy's help in adopting a baby. Meanwhile, Jim tries to make Pam happy with some pie.",2012-10-18
168,9,5,7.0,Here Comes Treble,"On Halloween, the Cornell a Capella group pays a visit to Andy, Dwight discovers that Nellie takes anxiety pills, and Pam disapproves of Jim's business decision.",2012-10-25
169,9,6,7.7,The Boat,"Andy has one last chance to captain the family boat before he sells it, Jim, Pam, and Nellie prank Dwight with a radio interview, and Kevin finds out about Oscar's affair with Angela's husband.",2012-11-08
170,9,7,7.6,The Whale,"The office trains Dwight to sell to a female client without being offensive, only to discover that the client is Jan Levinson. Angela and Oscar both think the senator is cheating on them, and Jim has trouble on an important conference call.",2012-11-15
171,9,8,7.8,The Target,"Angela orders a hit on Oscar for cheating with her husband, the office makes a tower with their customer complaint cards, Jim wines and dines Stanley and Phyllis in exchange for a favor, and Pam begins her mural.",2012-11-29
172,9,9,8.3,Dwight Christmas,"Dwight puts together a Pennsylvania Dutch-themed office Christmas party, but he ends it abruptly because Jim has to leave for his other job. Meanwhile, Erin seeks comfort from a co-worker after a disappointing text from Andy.",2012-12-06
173,9,10,7.6,Lice,"Pam causes a lice outbreak but lets Meredith take the blame, Jim has a business meeting with Dr. J, and some coworkers try to get Darryl and Val back together.",2013-01-10
174,9,11,7.9,Suit Warehouse,"Dwight and Clark pose as father and son to get an account, Darryl goes for an interview with Jim's new business, and everybody in the office goes crazy over a new espresso machine.",2013-01-17
175,9,12,8.0,Customer Loyalty,"Dwight tries to keep Daryl from leaving Dunder Mifflin, Jim misses his daughter's recital because of an important business meeting, and Nellie is worried that Erin will dump Andy for Pete.",2013-01-24
176,9,13,7.6,Junior Salesman,Dwight gets to hire a new salesman to replace Jim when he is at his other job. But will he promote Clark or go with one of his unqualified friends instead?,2013-01-31
177,9,14,7.5,Vandalism,"Pam tries to find out who vandalized her mural, Darryl finds out that Jim is a slob, and Oscar and Kevin go to Angela and The Senator's child's first birthday party.",2013-01-31
178,9,15,7.3,Couples Discount,"Andy returns after three months to an angry office and an even angrier girlfriend, and Jim's Valentines Day with Pam does not go as planned.",2013-02-07
179,9,16,8.1,Moving On,"Andy finds out that Erin dumped him for Pete, Dwight gets Angela's help taking care of his aunt, and Pam interviews with a real estate firm whose boss is a carbon-copy of Michael Scott.",2013-02-14
180,9,17,7.5,The Farm,Show follows Dwight Schrute a beet farmer running a bed and breakfast inn.,2013-03-14
181,9,18,8.0,Promos,"The release of the documentary promos creates tension for the Dunder Mifflin employees, Dwight considers a business venture with his girlfriend's family, and Jim and Darryl have an awkward business meeting with baseball player Ryan Howard.",2013-04-04
182,9,19,8.0,Stairmageddon,"Dwight shoots Stanley with a bull tranquilizer after he refuses to go on a sales call, Jim and Pam head to marriage counseling, The Senator comes out of the closet, and Andy tries to find a talent agent.",2013-04-11
183,9,20,8.0,Paper Airplane,"The employees hold a paper airplane competition, Andy gets an acting role in a workplace safety video, and Jim and Pam's marriage tensions continue to build.",2013-04-25
184,9,21,9.0,Livin' the Dream,"Dwight becomes regional manager after Andy quits his job, Jim dedicates more time to his Dunder Mifflin job to save his marriage, and Angela has problems with her new living arrangements after her breakup with The Senator.",2013-05-02
185,9,22,9.5,A.A.R.M.,"Dwight prepares for a marriage proposal and hires an assistant for his assistant, Andy auditions for a singing program, Darryl tries to leave his job without a fuss, and Pam has second thoughts about Jim staying in Scranton.",2013-05-09
186,9,24,9.8,Finale,"One year later, Dunder Mifflin employees past and present reunite for a panel discussion about the documentary and to attend Dwight and Angela's wedding.",2013-05-16
